{
  "schema_version": 1,
  "validation_id": "picocalc-template-b-r1",
  "roadmap_package": "R4",
  "target_id": "picocalc-template-b",
  "target_revision": 1,
  "target_contract_sha256": "60af985baabc77b8e52506d10f39946a9cca4f3ecbb120ea5549913426e1e4f9",
  "evidence": {
    "record": "firmware-validation/records/r2-20260806-01/report.json",
    "sha256": "b3ac55164df2386700cc62b3755b701f0ebf25eec86b0dc9a5a660bbf92a5e54",
    "record_id": "r2-20260806-01",
    "section": "one_command_acceptance"
  },
  "result": "accepted"
}
