{
  "evidence": {
    "record": "firmware-validation/records/vrp2-e-picoedit-20260829-01/record.json",
    "record_id": "vrp2-e-picoedit-20260829-01",
    "section": "firmware_run",
    "sha256": "fc9df65222d18a3dde14e0f96dd5dbac8879e416cf04c3fed7d8090211865be7"
  },
  "result": "accepted",
  "roadmap_package": "R4",
  "schema_version": 1,
  "target_contract_sha256": "93f31a8a449bbec6f0a3a8ded3fe8978fb9005a160227c12f5b01487d69dd40c",
  "target_id": "picoedit-r1-vrp2e",
  "target_revision": 3,
  "validation_id": "picoedit-r1-vrp2e-r3"
}
